Section,Summary,Question1,Answer1,Question2,Answer2,RawQnA
"§1,""Το κείμενο αναφοράς παρέχει μια επισκόπηση του εταιρικού δικαίου και των διαφόρων εννοιών που σχετίζονται με αυτό. Το κείμενο καλύπτει θέματα όπως νομικές δομές, οικονομική λειτουργία, έννοιες και περιλήψεις. Επιπλέον, το κείμενο συζητά τις προκλήσεις που αντιμετωπίζουν οι νομικοί στην προσπάθεια ορισμού της έννοιας της εταιρίας και τη σημασία της κατανόησης αυτών των προκλήσεων για την αποτελεσματική εφαρμογή του εταιρικού δικαίου."
Η έννοια της εταιρίας ως νομικής οντότητας που επιδιώκει κοινό σκοπό δεν είναι πλήρης και μπορεί να οδηγήσει σε ασάφειες κατά την αξιολόγηση άτυπων μορφών συμβατικής συνεργασίας. Η οικονομική σημασία των εταιριών έγκειται στην ικανότητά τους να μειώνουν το κόστος συναλλαγών, καθιστώντας τες ένα προτιμώμενο μέσο άσκησης επιχειρηματικής δραστηριότητας. Τα πλεονεκτήματα της ίδρυσης εταιρίας περιλαμβάνουν τη διατήρηση της επιχείρησης ανεξάρτητα από γεγονότα στα πρόσωπα των εταίρων και την δυνατότητα μετάβασης μεταξύ εταιρικών τύπων.
Το κείμενο συζητά τα οφέλη της χρήσης μίας εταιρικής μορφής για την άσκηση επιχειρηματικής δραστηριότητας ή τη συνεργασία σε επιχειρηματικές δραστηριότητες. Η εταιρική μορφή προσφέρει πλεονεκτήματα όπως συγκέντρωση κεφαλαίων από το ευρύ κοινό, ανάθεση της διοίκησης σε τρίτα πρόσωπα και περιορισμό των κινδύνων που σχετίζονται με την εισφερθείσα περιουσία χωρίς προσωπική ευθύνη του εταίρου για εταιρικά χρέη. Επιπλέον, η εταιρική μορφή επιτρέπει πολυποίκιλες δυνατότητες συνεργασίας, όπως αφανείς εταιρίες και εσωτερικές αστικές εταιρίες. Το κείμενο επισημαίνει επίσης τους περιορισμούς στην επιλογή εταιρικού τύπου λόγω της αρχής του κλειστού αριθμού των εταιρικών τύπων, η οποία επιβάλλει τη χρήση νομοθετικά προσφερόμενων εταιρικών μορφών χωρίς δυνατότητα δημιουργίας νέων.
Η επιλογή του εταιρικού τύπου ανάγεται κατά βάση στο εταιρικό δίκαιο και στα χαρακτηριστικά της κάθε εταιρικής μορφής σε συνδυασμό με τις ανάγκες των ενδιαφερομένων. Εάν π.χ. η ασκούμενη επιχείρηση έχει ανάγκη συγκέντρωσης κεφαλαίων, ενδείκνυται η επιλογή κάποιας κεφαλαιουχικής εταιρίας, εάν έχει σημασία η προσωπική συνεργασία των εταίρων, ενδείκνυται η επιλογή κάποιας προσωπικής εταιρίας, εάν ο σκοπός δεν είναι εμπορικός αποκλείονται οι προσωπικές εμπορικές εταιρίες κ.λπ. Πάντως η τάση ελαστικοποίησης του δικαίου των κεφαλαιουχικών εταιριών παρέχει μεγαλύτερες δυνατότητες επιλογών, όπως αποδεικνύεται από το γεγονός, ότι στην Ελλάδα έχει παραδοσιακά μεγάλη απήχηση στις συναλλαγές ο εταιρικός τύπος της ΑΕ, ακόμη και για μικρές επιχειρήσεις με προσωποπαγή χαρακτηριστικά, στις οποίες ενδεχομένως να ταίριαζε η εταιρική μορφή κάποιας προσωπικής εταιρίας. Εκτός από εταιρικοδικαιικά κριτήρια, καθοριστική σημασία παίζει το (δυστυχώς συχνά μεταβαλλόμενο) φορολογικό δίκαιο, το οποίο επηρεάζει τόσο τη φορολόγηση των κερδών της εταιρίας όσο και τη φορολόγηση των μεταβιβάσεων των εταιρικών συμμετοχών. Επίσης και το λογιστικό δίκαιο (βλ. ν. 4308/2014) και οι απορρέουσες από αυτό υποχρεώσεις κατάρτισης χρηματοοικονομικών καταστάσεων επηρεάζουν την επιλογή του εταιρικού τύπου, καθώς το είδος της εταιρίας επηρεάζει σε κάποιο βαθμό τις εν λόγω υποχρεώσεις. Τέλος η επιλογή του εταιρικού τύπου ανάγεται συχνά ακόμη και σε λόγους γοήτρου, καθώς π.χ. αλλιώς ηχεί η ΑΕ στις συναλλαγές και αλλιώς η ΕΠΕ.
Η έννοια της εταιρίας ορίζεται ως μία σύμβαση μεταξύ δύο τουλάχιστον προσώπων, τα οποία αναλαμβάνουν αμοιβαία την υποχρέωση να επιδιώκουν με κοινές εισφορές έναν κοινό σκοπό και ιδιαίτερα οικονομικό. Ο κοινός σκοπός αποτελεί θεμελιώδες εννοιολογικό και διακριτικό στοιχείο της εταιρίας από άλλες συμβατικές σχέσεις. Η εταιρία θα πρέπει να διακρίνεται από την κοινωνία, η οποία συνιστά κοινότητα συμφερόντων που περιλαμβάνει τη διοίκηση του κοινού πράγματος από όλους τους κοινωνούς.
Ο εταιρικός σκοπός είναι κρίσιμος για τη γέννηση και συνέχιση της εταιρίας. Ο εταιρικός σκοπός μπορεί να είναι κερδοσκοπικός ή οικονομικός ή ιδεαλιστικός. Η επίτευξη του εταιρικού σκοπού δεν συνεπάγεται απαραίτητα το τέλος της εταιρίας. Η εταιρία μπορεί να έχει οποιονδήποε σκοπό, αλλά οι προσωπικές εμπορικές εταιρίες πρέπει να έχουν κερδοσκοπικό σκοπό.
Το εταιρικό δίκαιο ρυθμίζει τις σχέσεις μεταξύ των εταίρων και της εταιρίας, καθώς και την εξωτερική εκπροσώπηση και δράση της εταιρίας. Ο εταιρικός σκοπός καθορίζει το δικαιοπρακτικό θεμέλιο στην εσωτερική σχέση μεταξύ των εταίρων, πράγμα που λειτουργεί περιοριστικά ως προς τη λήψη πλειοψηφικών αποφάσεων για μεταβολή του σκοπού. Το αντικείμενο (ή αντικείμενα) της εταιρίας είναι έννοια στενότερη του εταιρικού σκοπού και αφορά τη συγκεκριμένη δραστηριότητα, στην οποία δραστηριοποιείται η εταιρία με βάση την εταιρική σύμβαση.
Το εταιρικό συμφέρον είναι μία έννοια στο δίκαιο της ΑΕ, αλλά όχι μόνο σε αυτό τον εταιρικό τύπο. Είναι κρίσιμο για ζητήματα όπως η αποστολή της εταιρίας, η ενδοεταιρική αρμοδιότητα λήψης αποφάσεων, η υποχρέωση επιμελούς διαχείρισης και πίστης των εταιρικών διοικητών, την ευθύνη τους, τη λειτουργία των εταιρικών οργάνων, τις αμοιβές τους, το περιεχόμενο του εταιρικού συμφέροντος, τη σύναψη συμβάσεων με συνδεδεμένα μέρη, τις αμοιβές των εταιρικών διοικητών. Η θεωρία της «επιχείρησης καθ’ εαυτήν» έχει εγκαταλειφθεί ως ασυμβίβαστη με τις αρχές της ελεύ θερης οικονομίας. Το εταιρικό συμφέρον περιλαμβάνει τα συμφέροντα όχι μόνο των εταίρων αλλά και τρίτων που επηρεάζονται από τη λειτουργία της εταιρίας, όπως οι δανειστές, οι εργαζόμενοι, οι συναλλασσόμενοι, οι καταναλωτές, η κοινωνία, η εθνική οικονομία, το περιβάλλον κ.λπ. Η κρατούσα άποψη στην Ελλάδα είναι η μονιστική προσέγγιση του εταιρικού συμφέροντος, σύμφωνα με την οποία το εταιρικό συμφέρον ορίζεται ως το υπερατομικευμένο συμφέρον των εταίρων για ενίσχυση της μακροχρόνιας κερδοφορίας της επιχείρησης και μέσω αυτής της αξίας της εταιρικής συμμετοχής.
Το κείμενο συζητά τη νομική αυτοτέλεια των εταιριών και τον ρόλο τους στην οικονομική λειτουργία της διαχείρισης επενδεδυμένων κεφαλαίων. Το κείμενο επισημαίνει επίσης τις προκλήσεις που αντιμετωπίζουν οι εταιρικοί διοικητές κατά την λήψη επιχειρηματικών αποφάσεων, καθώς και το ευρύτερο ομιλικό συμφέρον σε ομίλους εταιριών.
"Η εταιρική κοινωνική ευθύνη είναι μία οικειοθελής υιοθέτηση πολιτικών και πρακτικών από εταιρίες – κυρίως μεγάλες πολυεθνικές – σε οικειοθελή βάση, με στόχο είτε τον περιορισμό των αρνητικών συνεπειών από τη δράση τους, είτε την προαγωγή σκοπών και αξιών, που τυγχάνουν γενικής αποδοχής, στους τομείς του περιβάλλοντος, των εργασιακών σχέσεων, της κοινωνίας, της καταπολέμησης της διαφθοράς, των ανθρωπίνων δικαιωμάτων και των δικαιωμάτων των καταναλωτών. Η εταιρική κοινωνική ευθύνη δεν είναι μία νομική υποχρέωση, αλλά βασίζεται στην αρχή της αυτοδέσμευσης: εναπόκειται στις ίδιες τις επιχειρήσεις τόσο το αν θα υιοθετήσουν μέτρα κοινωνικής υπευθυνότητας, όσο και το είδος αυτών (πρόκειται για """"soft law"""")."
Η έννοια της αποχής από πράξεις που ενδέχεται να θίγουν τα άξια προστασίας συμφέροντα τρίτων. Στο παθητικό αυτό επίπεδο εντάσσονται και τα προγράμματα φιλανθρωπιών και χορηγιών, τα οποία υπαγορεύονται από τους κανόνες του marketing. Οι πλέον ευαισθητοποιημένες κοινωνικά επιχειρήσεις επιδεικνύουν μια πιο «ενερ γητική» στάση, η οποία εκδηλώνεται με τη λήψη μέτρων και την υιοθέτηση αποτελεσματικών πολιτικών που στοχεύουν στη βελτίωση των συνθηκών στους προαναφερθέντες κρίσιμους τομείς. Η εταιρική κοινωνική ευθύνη έχει διεισδύσει στο ισχύον εταιρικό δίκαιο: με την Οδηγία 2014/95/ΕΕ, η οποία τροποποίησε την Οδηγία 2013/34/ΕΕ, επιβλήθηκε στις μεγάλες επιχειρήσεις δημοσίου συμφέροντος, με μέσο αριθμό εργαζο μένων άνω των 500, η δημοσιοποίηση μιας μη χρηματοοικονομικής κατάστασης που θα περιέχει τουλάχιστον πληροφορίες για περιβαλλοντικά, κοινωνικά και θέματα σχετικά με τους εργαζομένους, το σεβασμό των ανθρωπίνων δικαιωμάτων, την καταπολέμηση της διαφθοράς, καθώς και θέματα σχετικά με τη δωροδοκία. Η κατάσταση αυτή θα πρέπει να περιλαμβάνει περιγραφή των πολιτικών, των αποτελεσμάτων και των κινδύνων που συνδέονται με τα εν λόγω θέματα, ενώ θα πρέπει, επίσης, να προσαρτάται στην έκθεση διαχείρισης της επιχείρησης. Το ελληνικό δίκαιο προσαρμόστηκε στην Οδηγία 2014/95/ΕΕ με τα άρθρ. 151, 154 ν. 4548/2018. Η υποχρέωση παροχής πληροφόρησης για τις πολιτικές εταιρικής κοινωνικής ευθύνης προϋποθέτει την υιοθέτηση τέτοιων πολιτικών. Στο στοιχ. ε΄ της παρ. 1 του άρθρ. 151 ν. 4548/2018 προβλέπεται ότι εάν η εταιρία δεν ασκεί πολιτικές σε σχέση με ένα ή περισσότερα από τα θέματα που πρέπει να περιλαμβάνονται στη μη χρηματοοικονομική κατάσταση, θα πρέπει να περιλαμβάνει σαφή και αιτιολογημένη εξήγηση για την απουσία τέτοιων πολιτικών. Η διάταξη ακολουθεί την αρχή «συμμόρφωση ή αιτιολόγηση».
Οι συγκρούσεις συμφερόντων στις εταιρίες μπορούν να κατηγοριοποιηθούν σε τρεις κατηγορίες: (α) συγκρούσεις μεταξύ πλειοψηφίας μειοψηφίας, (β) συγκρούσεις μεταξύ εταίρων και εταιρικών διοικητών και (γ) συγκρούσεις μεταξύ εταιρίας (εταίρων) και τρίτων. Οι συγκρούσεις μεταξύ πλειοψηφίας – μειοψηφίας εμφανίζονται στις εταιρίες όπου ισχύει ο κανόνας της πλειοψηφικής λήψης αποφάσεων από τους εταίρους, όπως στην ΑΕ, όπου η φύση της προϋποθέτει τον κανόνα της πλειοψηφίας, αλλιώς θα καθίστατο πρακτικά αδύνατη η λειτουργία της (τουλάχιστον των ΑΕ ευρείας μετοχικής βάσης). Η προστασία της μειοψηφίας επιδιώκεται με διάφορους τρόπους, λαμβάνοντας υπόψη δύο παραμέτρους: ότι η πλειοψηφία θα πρέπει να «κυβερνά», καθώς η ισχύς συμβαδίζει με την επένδυση και τον αντίστοιχα αναλαμβανόμενο επενδυτικό κίνδυνο, και ότι δεν θα πρέπει να τεθεί σε κίνδυνο η εταιρική ομαλότητα, καθώς η υπερβολική ενίσχυση της μειοψηφίας μπορεί να παραλύσει τη λειτουργία της εταιρίας και να δώσει χώρο ακόμη και σε καταχρηστικές πρακτικές.
Στο κείμενο αναφέρονται τα εξής:

1. Η υποχρέωση πίστης της εταιρικής διοίκησης προς τους εταίρους μειοψηφίας.
2. Τρόποι ενίσχυσης των δικαιωμάτων των εταίρων μειοψηφίας μέσω ρητρών στην εταιρική σύμβαση και εξωεταιρικών συμφωνιών.
3. Το πρόβλημα κακοδιαχείρισης στις ΑΕ με ευρεία μετοχική βάση, λόγω διάστασης μεταξύ μετοχικής ιδιοκτησίας και εταιρικής διοίκησης (agency problem).
4. Μέτρα για την προστασία των εταίρων ως οικονομικών ιδιοκτητών της εταιρίας έναντι της εταιρικής διοίκησης: ανάκληση μελών ΔΣ, επιβολή υποχρέωσης επιμελούς διαχείρισης και υποχρέωσης πίστης, έλεγχος αμοιβών, κανόνες εταιρικής διακυβέρνησης, ενίσχυση ενημέρωσης και συμμετοχής μετόχων, λογοδοσία εταιρικής διοίκησης μέσω εκθέσεων προς τις γενικές συνελεύσεις, έλεγχος συναλλαγών εταιρικών διοικητών με την εταιρία.
Ενίσχυση της λογιστικής διαφάνειας και δημοσιότητας και του εξωτερικού ελέγχου των χρηματοοικονομικών καταστάσεων. Οι συγκρούσεις εταιρίας (εταίρων) – τρίτων αφορούν την «εξουσία» επί της εταιρικής περιουσίας, καθώς οι εταιρικοί δανειστές επιθυμούν την αύξηση της εταιρικής περιουσίας και την αποτροπή εκροής αυτής προς τους εταίρους. Από την άλλη πλευρά οι εταίροι επιδιώκουν τη μεγιστοποίηση της απόδοσης της επένδυσης μέσω διανομής εταιρικής περιουσίας ως κέρδους. Το πρόβλημα προστασίας των εταιρικών δανειστών τίθεται κυρίως για τους λεγόμενους «ακούσιους» πιστωτές (π.χ. εργαζόμενοι, μικροπιστωτές), καθώς έχουν μειωμένη διαπραγματευτική ισχύ και δεν μπορούν να ελέγξουν την πιστοληπτική ικανότητα της εταιρίας ή να λάβουν τις απαραίτητες διασφαλίσεις για την αξίωμά τους.
Η επιχείρηση είναι μία πολυσύνθετη έννοια που συναντάται σε διάφορους κλάδους δικαίου, με διαφορετικό περιεχόμενο ανάλογα με την αποστολή του κλάδου και το ρόλο του όρου. Η επιχείρηση ορίζεται ως ένα σύνολο ποικίλων ανομοιογενών στοιχείων, πραγμάτων, δικαιωμάτων, άϋλων αγαθών, πραγματικών καταστάσεων και σχέσεων προς την αγορά στην οποία δραστηριοποιείται.
Η περίληψη θα πρέπει να είναι σύντομη και περιεκτική, με τις 3-5 πιο σημαντικές έννοιες από το κείμενο. Κάθε έννοια δεν πρέπει να ξεπερνά τις 4 λέξεις σε μήκος. Η περίληψη θα πρέπει επίσης να είναι πρωτότυπη και όχι αντιγραφή του κειμένου. Οι έννοιες που εξάγονται από την περίληψη θα πρέπει να υπάρχουν στο αρχικό κείμενο.

Εννοίες:
#ΟΝΟΜΑ?
#ΟΝΟΜΑ?
#ΟΝΟΜΑ?
#ΟΝΟΜΑ?
#ΟΝΟΜΑ?
"- Δημόσιος τομέας"",Τι είναι το εταιρικό δίκαιο;,""Το εταιρικό δίκαιο, γνωστό και ως εταιρικός νόμος ή εταιρικός κώδικας, είναι ένα σύνολο κανόνων και κανονισμών που ρυθμίζουν τη δημιουργία, οργάνωση, λειτουργία και διάλυση των εταιριών. Σκοπός του εταιρικού δικαίου είναι να παρέχει ένα νομικό πλαίσιο για τις εταιρίες, προστατεύοντας τα δικαιώματα των μετόχων και πιστωτών της εταιρίας, εξασφαλίζοντας την οικονομική σταθερότητα της εταιρίας και προωθώντας τον ανταγωνισμό στην αγορά."",Ποια είναι η διαφορά μεταξύ εταιρικής μορφής και κοινωνίας;,""Η εταιρική μορφή διαφέρει από μία κοινωνία στο ότι μία εταιρία περιλαμβάνει τη διοίκηση του κοινού πράγματος από όλα τα μέλη, ενώ σε μία κοινωνία, ένα ή περισσότερα άτομα αναλαμβάνουν την ευθύνη για τη διαχείριση της κοινής περιουσίας. Επιπλέον, ο εταιρικός σκοπός είναι κρίσιμος για τη γέννηση και συνέχιση μίας εταιρίας, ενώ η κοινωνία βασίζεται στην κοινότητα συμφερόντων μεταξύ των μελών της."",""Ερώτηση 1: Τι είναι το εταιρικό δίκαιο;"
Απάντηση 1: Το εταιρικό δίκαιο, γνωστό και ως εταιρικός νόμος ή εταιρικός κώδικας, είναι ένα σύνολο κανόνων και κανονισμών που ρυθμίζουν τη δημιουργία, οργάνωση, λειτουργία και διάλυση των εταιριών. Σκοπός του εταιρικού δικαίου είναι να παρέχει ένα νομικό πλαίσιο για τις εταιρίες, προστατεύοντας τα δικαιώματα των μετόχων και πιστωτών της εταιρίας, εξασφαλίζοντας την οικονομική σταθερότητα της εταιρίας και προωθώντας τον ανταγωνισμό στην αγορά.
"Ερώτηση 2: Ποια είναι η διαφορά μεταξύ εταιρικής μορφής και κοινωνίας;"
"Απάντηση 2: Η εταιρική μορφή διαφέρει από μία κοινωνία στο ότι μία εταιρία περιλαμβάνει τη διοίκηση του κοινού πράγματος από όλα τα μέλη, ενώ σε μία κοινωνία, ένα ή περισσότερα άτομα αναλαμβάνουν την ευθύνη για τη διαχείριση της κοινής περιουσίας. Επιπλέον, ο εταιρικός σκοπός είναι κρίσιμος για τη γέννηση και συνέχιση μίας εταιρίας, ενώ η κοινωνία βασίζεται στην κοινότητα συμφερόντων μεταξύ των μελών της."""
