Section,Summary,Question1,Answer1,Question2,Answer2,RawQnA
Το κείμενο που δώσατε περιέχει μια λεπτομερή ανάλυση των νομικών εννοιών που σχετίζονται με την ομόρρυθμη εταιρία και τα δικαιώματα και τις υποχρεώσεις των εταίρων της. Η περίληψη θα πρέπει να επικεντρωθεί στις πιο σημαντικές έννοιες του κειμένου, όπως η έννοια της ομορρύθμου εταιρίας, οι εξουσίες και οι ευθύνες των διαχειριστών, το δικαίωμα εναντίωσης των εταίρων, ο συμψηφισμός και το δεδικασμένο.
Η ευθύνη των εταίρων για τα εταιρικά χρέη μπορεί να προκύπτει από αποφάσεις διοικητικών δικαστηρίων. Η σχέση μεταξύ των εταίρων είναι απλή ομοδικία και δεν έχουν δικαίωμα έφεσης εκτός αν ήταν διάδικοι στον πρώτο βαθμό. Οι εταίροι που δεν ήταν διάδικοι στη δίκη της εταιρίας με τον εταιρικό δανειστή μπορούν να ασκήσουν τριτανακοπή εφόσον επικαλούνται δόλο ή συμπαιγνία των διαδίκων, καθώς δεσμεύονται από το δεδικασμένο. Η δικονομική διάταξη του άρθρ. 920 ΚΠολΔ εφαρμόζεται και στην αδημοσίευτη ΟΕ, όπως και στην ανώμαλη ΟΕ.
Το άρθρο 92Ο του Κώδικα Πολιτικής Δικονομίας εφαρμόζεται σε κάθε είδους εκτελεστό τίτλο και καλύπτει όλους τους ευθυνόμενους εταίρους για τα εταιρικά χρέη σύμφωνα με το ουσιαστικό δίκαιο. Η εφαρμογή αυτού του άρθρου έχει ως συνέπεια ότι γεγονότα που διακόπτουν ή επιμηκύνουν την παραγραφή έναντι της εταιρίας ισχύουν επίσης και έναντι των εταίρων, με την επιφύλαξη εφαρμογής του άρθρου 269720.
Η διαταγή πληρωμής είναι εκτελεστός τίτλος κατά της ομόρρυθμης εταιρίας και μπορεί να επισπευστεί αναγκαστική εκτέλεση σε βάρος των εταίρων. Η προθεσμία για ανακοπή είναι δύο μήνες από την επίδοση προς την εταιρία. Εάν η διαταγή πληρωμής επιδοθεί δύο φορές στην εταιρία χωρίς να ασκηθεί εμπρόθεσμα ανακοπή, η αξίωση του κομιστή επιταγής ή συναλλαγματικής υπόκειται πλέον με βάση τα άρθρ. 633 παρ. 2 ΚΠολΔ, 268 ΑΚ σε εικοσαετή παραγραφή, που ισχύει τόσο έναντι της εταιρίας, όσο και έναντι των εταίρων. Η εκτέλεση κατά των εταίρων μπορεί να γίνει με όλα τα προβλεπόμενα μέσα εκτέλεσης του ΚΠολΔ. Προσωπική κράτηση ως μέσο αναγκαστικής εκτέλεσης δεν μπορεί να επιβληθεί κατά εταίρου, καθώς στο πρόσωπό του (ως εταίρου) δεν μπορούν να συντρέχουν οι προϋποθέσεις της αδικοπραξίας (οι οποίες μόνο στο πρόσωπο των διαχειριστών ή προστηθέντων της εταιρίας μπορούν να συντρέχουν). Η θέση της εταιρίας υπό αναγκαστική διαχείριση σύμφωνα με τα άρθρ. 1034 επ. ΚΠολΔ δεν επιδρά στο κύρος της αναγκαστικής εκτέλεσης κατά του εταίρου με εκτελεστό τίτλο κατά της εταιρίας.
Οι εναγόμενοι συνεταίροι δεν μπορούν να προβάλουν ένσταση εκ του άρθρ. 745 ΑΚ, καθώς δεν πρόκειται για συμπληρωματική εισφορά, αλλά για αναγωγική ευθύνη έναντι του καταβαλόντος συνεταίρου τους. Η αναγωγή έναντι των συνεταίρων αφορά όχι το συνολικά καταβληθέν ποσό, όπως έναντι της εταιρίας, αλλά το επιπλέον του ποσοστού του καταβαλόντος εταίρου καταβληθέν ποσό.
Η ευθύνη των εταίρων για τα εταιρικά χρέη διέπεται από το άρθρο 258 του ν. 4072/2012. Σύμφωνα με αυτό, οι εταίροι ευθύνονται αλληλεγγύως και εις ολόκληρον για τα χρέη της εταιρίας προς τρίτους κατά τη διάρκεια λειτουργίας της. Η ευθύνη αυτή δεν μπορεί να περιοριστεί ή αποκλειστεί χωρίς τη συναίνεση των δανειστών. Σε περίπτωση εξόδου εταίρου, αυτός ευθύνεται αναγωγικά έναντι των υπολοίπων εταίρων για το μέρος του εταιρικού χρέους που αναλογεί στο ποσοστό συμμετοχής του στην εταιρία. Εάν η αποχώρηση έγινε μέσω μεταβίβασης της εταιρικής συμμετοχής, η αναγωγή αφορά και τον αποκτήσαντα την εταιρική συμμετοχή.
Οι εταίροι δεν θα ευθύνονται ή ότι ο εταιρικός δανειστής θα στραφεί πρώτα ή μόνο (pactum de non petendo) κατά της εταιρίας. Οι συμφωνίες αυτές αφορούν την εξωτερική ευθύνη των εταίρων και όχι τις εσωτερικές τους σχέσεις. Η ευθύνη του εισερχομένου εταίρου δημιουργείται από το χρόνο εισόδου του ανεξάρτητα από τη γνώση εκ μέρους του ή εκ μέρους των λοιπών εταίρων της ύπαρξης εταιρικών χρεών ή από την καλή πίστη των εταιρικών δανειστών.
Η ευθύνη ενός αποχωρούντος εταίρου για τα χρέη της ομόρρυθμης εταιρίας περιορίζεται στα «παλαιά» χρέη που υφίστανται κατά το χρόνο της αποχώρησης. Τα «νέα» χρέη δεν ευθύνονται. Η ευθύνη του αποχωρούντος εταίρου είναι παρόμοια με την ευθύνη των υφισταμένων εταίρων και είναι απαραίτητη για τη διατήρηση της εμπορικής πίστης της ΟΕ.
Ο αποχωρήσας εταίρος ευθύνεται για τα «παλαιά» εταιρικά χρέη που δημιουργήθηκαν πριν την αποχώρησή του και μέχρι τη δημοσίευση αυτής στο Γ.Ε.ΜΗ., εφόσον οι εταιρικοί δανειστές είναι καλόπιστοι. Η ευθύνη του καλύπτει επίσης τα χρέη που δημιουργούνται μετά την αποχώρησή του και μέχρι τη δημοσίευση, εάν οι εταιρικοί δανειστές είναι καλόπιστοι.
Το άρθρ. 269 του ν. 4072/2012 προβλέπει μια ειδική παραγραφή για τις αξιώσεις των εταιρικών δανειστών κατά των εταίρων σε περίπτωση λύσης της εταιρίας και εξόδου εταίρου, η οποία ισχύει και ως προς την ευθύνη του εξελθόντoς ή αποκλεισθέντος εταίρου. Η ρύθμιση αυτή επιδιώκει να εξασφαλίσει ότι οι εταίροι δεν θα βαρύνονται από τα εταιρικά χρέη επ' αόριστον, επιτρέποντας έτσι μια γρήγορη επαναδραστηριοποίηση των εταίρων επιχειρηματικά χωρίς το βάρος των παλαιών εταιρικών οφειλών. Το κρίσιμο χρονικό σημείο για την έναρξη της παραγραφής είναι η διαγραφή της εταιρίας από το Γ.Ε.ΜΗ., όχι η λύση της. Η ειδική παραγραφή ισχύει για όλες τις αξιώσεις των εταιρικών δανειστών κατά της εταιρίας, ανεξάρτητα από την αιτία τους ή τη συμμετοχή του εταίρου ως εκκαθαριστή.
Η ειδική παραγραφή του άρθρου 269 εφαρμόζεται και στις ομόρρυθμες εταιρίες με την προϋπόθεση ότι η εταιρία έχει λυθεί ή αποχωρήσει εταίρος από αυτήν. Η παραγραφή εκκινεί από το χρονικό σημείο της καταχώρισης στο Γ.Ε.ΜΗ., εκτός αν η απαίτηση καταστεί ληξιπρόθεσμη μετά την καταχώριση, οπότε η παραγραφή εκκινεί από τότε που η απαίτηση καθίσταται ληξιπρό θεσμη. Αν εκδοθεί τελεσίδικη δικαστική απόφαση κατά του εταίρου μέχρι το πέρας πενταετίας από τη λύση της εταιρίας, ισχύει πλέον ως προς αυτόν η εικοσαετής παραγραφή του άρθρου 268 ΑΚ. Η ειδική παραγραφή δεν εφαρμόζεται σε περιπτώσεις όπου ο ετερόρρυθμος εταίρος ευθύνεται προσωπικά έναντι των εταιρικών δανειστών.
Η περίληψη είναι η εξής:

1. Η ευθύνη των εταίρων για τα εταιρικά χρέη δεν ισχύει πλέον όταν ο εταιρικός τύπος της προσωπικής εμπορικής εταιρίας και προσωπικά ευθυνόμενοι εταίροι παύσουν να ευθύνονται προσωπικά.
2. Ειδικές διατάξεις στο δίκαιο των εταιρικών μετασχηματισμών υιοθετούν το μοντέλο της ειδικής πενταετούς παραγραφής από τη συντέλεση του μετασχηματισμού (βλ. άρθρ. 29, 82, 127 ν. 4601/2019).
3. Εάν μετά τη λύση αναβιώσει η εταιρία ή μετασχηματισθεί σε άλλη μορφή, δεν ισχύει η ειδική παραγραφή της παρ. 1 του άρθρ. 269.
"4. Η κρατούσα άποψη τάσσεται κατά της εφαρμογής του άρθρ. 269 στην αδημοσίευτη ΟΕ λόγω μη καταχώρισης του γεγονότος της λύσης της εταιρίας στο Γ.Ε.ΜΗ., αλλά αυτή η άποψη δεν θα πρέπει να θεωρηθεί ορθή."",Ποια είναι η νομική βάση της ευθύνης των ομορρύθμων εταίρων για τα εταιρικά χρέη;,""Η νομική βάση της ευθύνης των ομορρύθμων εταίρων για τα εταιρικά χρέη είναι το άρθρο 249 παρ. 1 του ελληνικού εμπορικού δικαίου, σύμφωνα με το οποίο οι εταίροι ευθύνονται απεριόριστα και εις ολόκληρον για τις υποχρεώσεις της εταιρίας."",Ποια είναι η φύση της ευθύνης μεταξύ των ομορρύθμων εταίρων;,""Η ευθύνη μεταξύ των ομορρύθμων εταίρων είναι παθητική εις ολόκληρον. Αυτό σημαίνει ότι εάν ένας εταίρος ικανοποιήσει εταιρικό δανειστή, έχει αναγωγικά δικαιώματα κατά της εταιρίας και των συνεταίρων του."",""Ερώτηση 1: Ποια είναι η νομική βάση της ευθύνης των ομορρύθμων εταίρων για τα εταιρικά χρέη;"
Απάντηση 1: Η νομική βάση της ευθύνης των ομορρύθμων εταίρων για τα εταιρικά χρέη είναι το άρθρο 249 παρ. 1 του ελληνικού εμπορικού δικαίου, σύμφωνα με το οποίο οι εταίροι ευθύνονται απεριόριστα και εις ολόκληρον για τις υποχρεώσεις της εταιρίας.
"Ερώτηση 2: Ποια είναι η φύση της ευθύνης μεταξύ των ομορρύθμων εταίρων;"
"Απάντηση 2: Η ευθύνη μεταξύ των ομορρύθμων εταίρων είναι παθητική εις ολόκληρον. Αυτό σημαίνει ότι εάν ένας εταίρος ικανοποιήσει εταιρικό δανειστή, έχει αναγωγικά δικαιώματα κατά της εταιρίας και των συνεταίρων του."""
"§9,""Στο κείμενο που δόθηκε, γίνεται αναφορά στο κληρονομικό δίκαιο και τον τρόπο με τον οποίο εφαρμόζεται στις προσωπικές εταιρίες, ιδιαίτερα στην ομόρρυθμη εταιρία. Το κείμενο συζητά επίσης τις αλλαγές στους νόμους περί προσωπικών εταιριών και την επίδρασή τους στη διαχείριση της εταιρικής συμμετοχής σε περίπτωση θανάτου ενός εταίρου. Επιπλέον, το κείμενο εξετάζει τη σχέση μεταξύ του κληρονομικού δικαίου και του εταιρικού δικαίου, καθώς και τα δικαιώματα και τις υποχρεώσεις των ομορρύθμων και ετερορρύθμων εταίρων. Τέλος, το κείμενο συζητά τον αποκλεισμό ενός εταίρου από την εταιρία και τους σχετικούς νόμους και κανονισμούς."
Η ομόρρυθμη εταιρία είναι μια προσωπική εμπορική εταιρία που διέπεται από τις διατάξεις του εταιρικού δικαίου. Ο αποκλεισμός ενός εταίρου μπορεί να γίνει με δικαστική απόφαση ή με συμφωνία όλων των εταίρων. Η λύση της εταιρίας μπορεί να γίνει με το θάνατο ενός εταίρου, αλλά οι κληρονόμοι του μπορούν να συνεχίσουν την επιχείρηση.
Η σημασία του προσώπου των εταίρων στις προσωπικές εταιρίες είναι μεγάλη λόγω της συμβατικής τους βάσης και του στενού προ σωπι κού δεσμού μεταξύ των εταίρων. Το πρόσωπο των εταίρων έχει σημασία σε δύο επίπεδα: πρώτον σχετικά με τις συνέπειες για την εταιρία γεγονότων στο πρόσωπο των εταίρων, και δεύτερον ως προς το ζήτημα της μεταβολής του προσώπου των εταίρων. Στο δίκαιο της αστικής εταιρίας χωρίς νομική προσωπικότητα (άρθρ. 741 επ. ΑΚ) ο θάνατος, η πτώχευση και η θέση εταίρου υπό δικαστική συμπαράσταση επιφέρουν τη λύση της εταιρίας χωρίς όμως η συνέπεια αυτή να είναι αναγκαστικό δίκαιο, καθώς μπορεί να συμφωνηθεί στην μεν πρώτη περίπτωση η συνέχιση της εταιρίας μεταξύ των λοιπών εταίρων ή μεταξύ αυτών και των κληρονόμων (άρθρ. 773 – 775 ΑΚ), στις δε λοιπές περιπτώσεις, η συνέχιση της εταιρίας μεταξύ των λοιπών εταίρων. Το ζήτημα της μεταβίβασης της εταιρικής συμμετοχής δεν ρυθμίζεται στον ΑΚ777, όμως γίνεται δεκτό από την κρατούσα άποψη ότι επιτρέπονται εάν συμφωνήσουν οι λοιποί εταίροι ή υπάρχει σχετική πρόβλεψη στην εταιρική σύμβαση778. Οι ως άνω ρυθμίσεις είναι συμβατές με τα χαρακτηριστικά και την αποστολή της αστικής εταιρίας χωρίς νομική προσωπικότητα, η οποία δεν προορίζεται να λειτουργήσει ως φορέας άσκησης επιχειρηματικής δραστηριότητας, και μεταφέρουν στο δίκαιο αυτής τον γενικότερο κανόνα 777.
Με βάση το παρεχόμενο κείμενο, περίγραψε συνοπτικά τους κανόνες που διέπουν την είσοδο νέων εταίρων σε μια προσωπική εμπορική εταιρία και τις επιπτώσεις της στην εταιρική δομή.
Η μεταβίβαση της εταιρικής συμμετοχής σε μία ομόρρυθμη εταιρία μπορεί να γίνει με διάφορους τρόπους. Ένας τρόπος είναι η ολική μεταβίβαση, όπου ο εταίρος μεταβιβάζει όλη τη συμμετοχή του (και αποχωρεί από την εταιρία) σε περισσότερα του ενός πρόσωπα, τα οποία εισέρχονται στην εταιρία με διακριτές εταιρικές συμμετοχές. Ένας άλλος τρόπος είναι η μερική μεταβίβαση, όπου ο εταίρος διατηρεί ένα μέρος της συμμετοχής του και μεταβιβάζει το υπόλοιπο σε άλλο πρόσωπο, το οποίο εισέρχεται στην εταιρία ως νέος εταίρος. Η μεταβίβαση της εταιρικής συμμετοχής ενεργεί για το μέλλον, πράγμα που σημαίνει ότι ο νέος εταίρος έχει δικαίωμα επί των από της εισόδου του στην εταιρία και εφεξής πραγματοποιηθέντων κερδών.
Η μεταβίβαση μιας εταιρικής συμμετοχής από έναν εταίρο σε άλλον συνήθως περιλαμβάνει μια διαθετική δικαιοπραξία που μπορεί να είναι οποιαδήποτε αιτία. Η πώληση πλειοψηφικού πακέτου μετοχών σε κάποιον που αποκτά τον έλεγχο της εταιρίας θα μπορούσε ενδεχομένως να θεωρηθεί ως πώληση ολόκληρης της εταιρικής επιχείρησης, οδηγώντας σε ευθύνη του μεταβιβάζοντος για μη ανταπόκριση τόσο της εταιρικής συμμετοχής όσο και της εταιρικής επιχείρησης. Η σύμβαση μεταβίβασης της εταιρικής συμμετοχής δεν υπόκειται σε τύπο εκτός αν προβλέπεται από την εταιρική σύμβαση. Σύμφωνα με την κρατούσα άποψη, η μεταβίβαση μιας εταιρικής συμμετοχής συνιστά τροποποίηση της εταιρικής σύμβασης καθώς μεταβάλλονται τα πρόσωπα των εταίρων και υπόκειται σε εμπορική δημοσιότητα μέσω του Γ.Ε.ΜΗ. Το ζήτημα του χαρακτήρα της δημοσιότητας είναι έντονα συζητήσιμο, με κάποιες απόψεις να υποστηρίζουν ότι είναι συστατική ενώ άλλες δηλωτική.
Η μεταβίβαση της εταιρικής συμμετοχής σε μια ομόρρυθμη εταιρία μπορεί να γίνει χωρίς τη συναίνεση των υπολοίπων εταίρων, αλλά είναι άκυρη υπέρ της εταιρίας και των υπόλοιπων εταίρων. Η δημοσιότητα στο Γ.Ε.ΜΗ. δεν απαιτείται για την εταιρική σύμβαση, αλλά μόνο για τη συμφωνία μεταβίβασης. Εάν η μεταβίβαση δεν επιτρέπεται βάσει του καταστατικού ή συμφωνίας μεταξύ των εταίρων, ο αποκτών δικαιούται να αναζητήσει το τίμημα που κατέβαλε στον μεταβιβάζοντα από τον τελευταίο σύμφωνα με τις διατάξεις περί αδικαιολογήτου πλουτισμού.
Η ομόρρυθμη εταιρία είναι μια εταιρική σχέση μεταξύ δύο ή περισσότερων ατόμων που επιδιώκουν ένα κοινό σκοπό. Οι εταίροι είναι υπεύθυνοι για τις υποχρεώσεις της εταιρίας και έχουν ίσα δικαιώματα και υποχρεώσεις. Η εταιρική σύμβαση καθορίζει τους όρους λειτουργίας της εταιρίας, συμπεριλαμβανομένων των δικαιωμάτων και υποχρεώσεων των εταίρων, του τρόπου διαχείρισης της εταιρίας και του τρόπου διανομής των κερδών. Η ομόρρυθμη εταιρία μπορεί να διαλυθεί με τη συμφωνία όλων των εταίρων ή εάν ένας εταίρος αποχωρήσει από την εταιρία.
Η έξοδος ενός εταίρου από μία ομόρρυθμη εταιρία μπορεί να συμβεί είτε εκούσια είτε αναγκαστική. Η αναγκαστική έξοδος συνήθως συμβαίνει λόγω γεγονότων στο πρόσωπο του εταίρου, όπως ο θάνατος ή η πτώχευση. Όταν ένας εταίρος εξέρχεται από την εταιρία, οι σχέσεις με τον εξερχόμενο εταίρο και οι σχέσεις των εναπομεινάντων εταίρων για το μέλλον ρυθμίζονται μέσω τροποποίησης της εταιρικής σύμβασης. Επιπλέον, η έξοδος ενός εταίρου είναι δημοσιευτέα στο Γ.Ε.ΜΗ., και η δημοσιότητα έχει δηλωτικό χαρακτήρα, εκτός από τις περιπτώσεις εξόδου (αποκλεισμού) δυνάμει δικαστικής απόφασης, όπου η δημοσιότητα έχει πληροφοριακό χαρακτήρα.
Η έξοδος της εταίρου – εταιρίας επέρχεται από εκείνο το χρονικό σημείο, που καθίσταται πλέον αδύνατη η αναβίωσή της με την έννοια της επανόδου της εταίρου – εταιρίας στην παραγωγική λειτουργία. Εάν δεν υπάρχει σχετική πρόβλεψη στην εταιρική σύμβαση (π.χ. ότι επέρχεται η έξοδος με τη λύση της εταίρου - εταιρίας) και δεν προκύπτει κάτι μέσω συμπληρωματικής ερμηνείας της εταιρικής σύμβασης, η έξοδος της εταίρου – εταιρίας επέρχεται από εκείνο το χρονικό σημείο, που καθίσταται πλέον αδύνατη η αναβίωσή της με την έννοια της επανόδου της εταίρου – εταιρίας στην παραγωγική λειτουργία.
