Section,Summary,Question1,Answer1,Question2,Answer2,RawQnA
Οι εισφορές των εταίρων στην Ομόρρυθμη Εταιρεία είναι συνήθως σε χρήμα ή είδος, ανάλογα με το ποσοστό συμμετοχής τους. Η εταιρική σύμβαση θα πρέπει να περιλαμβάνει τα ατομικά στοιχεία των εταίρων και την επωνυμία της ΟΕ, καθώς και το ελάχιστο περιεχόμενο που απαιτείται για τη δημοσίευση στο Γ.Ε.ΜΗ., όπως προβλέπεται από τον νόμο.
Η ΟΕ είναι μία ομόρρυθμη εταιρία. Η έδρα της είναι ο δήμος. Σκοπός της εταιρίας είναι το αντικείμενο της εταιρικής δραστηριότητας. Ο εκπρόσωπος της εταιρίας ονομάζεται διαχειριστής και έχει συγκεκριμένες αρμοδιότητες. Οι εισφορές των εταίρων αναφέρονται στην εταιρική σύμβαση.
Η Ομόρρυθμη Εταιρεία είναι μία εταιρική μορφή που απαιτεί τουλάχιστον δύο εταίρους και έχει απεριόριστη ευθύνη για τα χρέη της εταιρείας. Η διάρκεια μίας ΟΕ μπορεί να είναι είτε ορισμένου χρόνου είτε αορίστου χρόνου, αλλά εάν δεν αναφέρεται η διάρκεια, θεωρείται ότι η εταιρεία είναι αορίστου χρόνου. Οι εταίροι συμμετέχουν στα κέρδη και στις ζημιές της εταιρείας με βάση το ποσοστό συμμετοχής τους στην εταιρεία. Η διαχείριση και εκπροσώπηση μίας ΟΕ γίνεται από κοινού ή μεμονωμένα από τους εταίρους.
Η Ομόρρυθμη Εταιρεία είναι μία εταιρική μορφή που απαιτεί τουλάχιστον δύο εταίρους και η ευθύνη τους για τα χρέη της εταιρείας είναι απεριόριστη. Η εταιρεία πρέπει να έχει έναν διαχειριστή εταίρο, ο οποίος μπορεί επίσης να είναι νομικό πρόσωπο. Οι εταίροι συμμετέχουν στα κέρδη και τις ζημιές ανάλογα με το ποσοστό συμμετοχής τους. Το καταστατικό της εταιρείας πρέπει να περιλαμβάνει την επωνυμία του νομικού προσώπου, τον αριθμό Γ.Ε.ΜΗ., τον Α.Φ.Μ., τη διεύθυνση ηλεκτρονικού ταχυδρομείου και άλλες σχετικές πληροφορίες. Η εταιρεία πρέπει να εγγραφεί στο Γ.Ε.ΜΗ. για να αποκτήσει νομική προσωπικότητα. Εάν η εταιρική σύμβαση είναι άκυρη ή ακυρώσιμη λόγω πλάνης, απάτης ή απειλής, μπορεί να θεραπευτεί εάν η εταιρεία έχει λειτουργήσει. Οι συναλλαγές που διενήργησε η ελαττωματική ΟΕ μέχρι την προβολή του ελαττώματος της εταιρικής σύμβασης παραμένουν ισχυρές εφαρμοζομένου του δικαίου που διέπει την ΟΕ.
Η ΟΕ είναι μια προσωπική εταιρεία που λειτουργεί ως νομικό πρόσωπο και έχει νομική προσωπικότητα. Είναι ένα είδος εταιρείας όπου οι εταίροι έχουν απεριόριστη ευθύνη για τα χρέη της εταιρείας. Η ΟΕ μπορεί να ιδρυθεί από δύο ή περισσότερα άτομα, αλλά δεν μπορεί να υπερβαίνει τους πενήντα εταίρους. Οι εταίροι πρέπει να είναι φυσικά πρόσωπα, αλλά μπορούν επίσης να είναι νομικά πρόσωπα. Η εταιρική σύμβαση πρέπει να καταρτιστεί εγγράφως και να υπογραφεί από όλους τους εταίρους. Η εταιρική σύμβαση πρέπει να περιλαμβάνει διατάξεις σχετικά με τη διοίκηση της εταιρείας, τα δικαιώματα και τις υποχρεώσεις των εταίρων, καθώς και την κατανομή των κερδών και ζημιών. Η ΟΕ πρέπει να έχει έδρα στην Ελλάδα και πρέπει να τηρεί βιβλία και αρχεία σύμφωνα με τον νόμο. Η ΟΕ πρέπει επίσης να υποβάλλει ετήσιες οικονομικές καταστάσεις στο Γ.Ε.ΜΗ.
Η έννοια της ανώμαλης εταιρίας βρίσκει εφαρμογή σε ελαττωματικές τροποποιήσεις της εταιρικής σύμβασης, εφόσον έχουν δομικό χαρακτήρα, υπό την προϋπόθεση ότι αυτές έχουν εκτελεστεί. Η ανατροπή της ελαττωματικής μεταβολής εξαρτάται από το είδος της (π.χ., στην ελαττωματική λύση απαιτείται απόφαση αναβίωσης της εταιρίας, στην ελαττωματική είσοδο απαιτείται άσκηση δικαιώματος εξόδου ή αποκλεισμού).
Η ομόρρυθμη εταιρία αποκτά νομική προσωπικότητα από την καταχώρισή της στο Γενικό Εμπορικό Μητρώο (Γ.Ε.ΜΗ.). Η διαδικασία σύστασης μίας ομόρρυθμης εταιρίας διεκπεραιώνεται από την Υπηρεσία Μίας Στάσης, η οποία είναι υπεύθυνη για τη διενέργεια όλων των απαραίτητων ενεργειών και την υποβολή όλων των απαραίτητων στοιχείων και εγγράφων. Για να καταχωρηθεί μία ομόρρυθμη εταιρία στο Γ.Ε.ΜΗ., απαιτείται η σύμπραξη όλων των εταίρων ή ενός προσώπου εξουσιοδοτημένου νομίμως από αυτούς. Η ΥΜΣ ελέγχει την πληρότητα και νομιμότητα των υποβληθέντων στοιχείων και εγγράφων, καθώς και τη χρήση της εταιρικής επωνυμίας και του διακριτικού τίτλου μέσω του Μητρώου Επωνυμιών και Διακριτικών Τίτλων. Εάν τα υποβληθέντα έγγραφα δεν πληρούν τις προϋποθέσεις του νόμου, οι ενδιαφερόμενοι καλούνται να τα συμπληρώσουν ή να τα διορθώσουν. Μετά την ολοκλήρωση αυτών των ελέγχων, η ΥΜΣ ψηφιοποιεί και καταχωρίζει τα υποβληθέντα έγγραφα στο πληροφοριακό σύστημα ΥΜΣ, το οποίο εκτελεί αυτόματα διάφορες ενέργειες, συμπεριλαμβανομένης της χορήγησης γραμματίου ενιαίου κόστους σύστασης εταιρίας.
Η διαδικασία ίδρυσης μίας Ομόρρυθμης Εταιρίας (ΟΕ) στην Ελλάδα περιλαμβάνει πολλά βήματα. Η εταιρία πρέπει να εγγραφεί στο Γενικό Εμπορικό Μητρώο (Γ.Ε.ΜΗ.) και να λάβει Αριθμό Φορολογικού Μητρώου (ΑΦΜ). Πρέπει επίσης να εγγραφεί στο μητρώο εργοδοτών του e-Ε.Φ.Κ.Α. και να εκδώσει ψηφιακά υπογεγραμμένο αντίγραφο της ανακοίνωσης – βεβαίωσης σύστασης της εταιρίας, αναπόσπαστο μέρος της οποίας αποτελεί και η εταιρική σύμβαση. Η εταιρία πρέπει επίσης να εγγραφεί στο μητρώο του αρμόδιου επιμελητηρίου. Εναλλακτικά της ως άνω διαδικασίας μέσω της ΥΜΣ, μπορεί η ίδρυση της ΟΕ να γίνει μέσω της Ηλεκτρονικής Υπηρεσίας Μίας Στάσης (e-ΥΜΣ), δηλ. εξ ολοκλή ρου ηλεκτρονικά με τη χρήση εξειδικευμένης ψηφιακής πλατφόρμας μέσω του διαδικτυακού τόπου του Γ.Ε.ΜΗ.
Η αδημοσίευτη ΟΕ έχει απεριόριστη και εις ολόκληρον ευθύνη των εταίρων για τις εταιρικές υποχρεώσεις, καθώς και εφαρμογή της ατομικής εκπροσώπησης. Οι αποκλίνοντες συμφωνίες των εταίρων (π.χ. ως προς τον τρόπο εκπροσώπησης) δεν ισχύουν έναντι τρίτων, εκτός κι αν αποδειχθεί ότι οι τρίτοι γνώριζαν γι' αυτές.
Η λειτουργούσα αδημοσίευτη ΟΕ είναι νομικό πρόσωπο με ικανότητα δικαίου και πτωχευτική ικανότητα. Η εφαρμογή του δικαίου της δημοσιευμένης ΟΕ προϋποθέτει πλήρη ικανότητα δικαίου, την οποία η λειτουργούσα αδημοσίευτη ΟΕ διαθέτει χωρίς να υστερεί σε τίποτε έναντι της δημοσιευμένης ΟΕ.
Η αδημοσίευτη ΟΕ αναγνωρίζεται πλέον από το δίκαιο και δεν θεωρείται μορφή ελαττωματικής εταιρίας. Η μη δημοσίευση στο Γ.Ε.ΜΗ. μπορεί να θεμελιώσει λόγο λύσης της εταιρίας με δικαστική απόφαση σύμφωνα με το άρθρ. 259, εάν π.χ. κάποιοι εκ των εταίρων δεν συμπράττουν στη διεκπεραίωση της διαδικασίας δημοσίευσης στο Γ.Ε.ΜΗ., πράγμα που μπορεί να θίγει τα συμφέροντα άλλων εταίρων.
Αυτή είναι μία περίληψη της έννοιας και ίδρυσης της Ομόρρυθμης Εταιρίας. Η ομόρρυθμη εταιρία είναι ένας εταιρικός τύπος που απαιτεί τουλάχιστον δύο εταίρους και απεριόριστη ευθύνη των εταίρων για τα χρέη της εταιρίας. Οι εταίροι ευθύνονται προσωπικά για τις υποχρεώσεις της εταιρίας, πράγμα που σημαίνει ότι οι προσωπικοί τους περιουσιακοί πόροι μπορούν να χρησιμοποιηθούν για την κάλυψη οποιωνδήποτε χρεών ή υποχρεώσεων της εταιρίας. Η ομόρρυθμη εταιρία δεν χρειάζεται να έχει νομική προσωπικότητα, αλλά πρέπει να καταχωρηθεί στο Γ.Ε.ΜΗ. και να έχει εμπορικό σκοπό.
Η ΟΕ είναι μια μορφή εταιρικής σχέσης όπου δύο ή περισσότερα άτομα συμφωνούν να μοιραστούν τα κέρδη και τις ζημίες που προκύπτουν από τη διαχείριση μιας επιχείρησης. Η ίδρυση μιας ΟΕ απαιτεί την υπογραφή ενός συμφωνητικού μεταξύ των εταίρων, το οποίο πρέπει να περιλαμβάνει λεπτομέρειες σχετικά με τους ρόλους και τις ευθύνες κάθε εταίρου, καθώς και τον τρόπο διανομής των κερδών και ζημιών. Επιπλέον, η ΟΕ πρέπει να εγγραφεί στο Γενικό Εμπορικό Μητρώο (ΓΕΜΗ) για να αποκτήσει νομική προσωπικότητα και να μπορεί να διεξάγει επιχειρηματικές δραστηριότητες.
Η θεωρία της πραγματικής έδρας κρατεί απολύτως στη νομολογία (Ολ ΑΠ 2/1999, 461/1978) και στη θεωρία. Αντίθετο δεν προκύπτει από τη διάταξη του άρθρου 48 (πρώην 58) της Συνθήκης της Ευρωπαϊκής Ένωσης που ορίζει ότι «οι εταιρείες που έχουν συσταθεί σύμφωνα με τη νομοθεσία ενός Κράτους-μέλους και οι οποίες έχουν την καταστατική τους έδρα, την κεντρική τους διοίκηση ή την κύρια εγκατάστασή τους εντός της Κοινότητας εξομοιώνονται, για την εφαρμογή των διατάξεων του παρόντος κεφαλαίου, προς τα φυσικά πρόσωπα που είναι υπήκοοι των κρατών-μελών».
Η περίληψη του κειμένου είναι η εξής:

- Η ΟλΑΠ έχει κρίνει ότι οι Ομόρρυθμες Εταιρίες (ΟΕ) μπορούν να χαρακτηριστούν ως αδημοσίευτες όταν δεν έχουν νομική προσωπικότητα. Σε αυτή την περίπτωση, οι εταίροι ευθύνονται προσωπικά για τις υποχρεώσεις της εταιρίας.
- Το ΔΕΕ έχει αποφασίσει ότι σύμφωνα με το δίκαιο της ΕΕ, οι εταιρίες που έχουν συσταθεί σε ένα κράτος μέλος πρέπει να αναγνωρίζονται και στα υπόλοιπα κράτη μέλη. Αυτό σημαίνει ότι αν μια εταιρία έχει ιδρυθεί νόμιμα σε ένα κράτος μέλος, θα πρέπει επίσης να αναγνωρίζεται ως νόμιμη στο άλλο κράτος μέλος.
"- Η ευθύνη των εταίρων για τις υποχρεώσεις μιας αδημοσίευτης ΟΕ δεν θα πρέπει να συγχέεται με την ευθύνη λόγω κάμψης της νομικής προσωπικότητας. Στην πρώτη περίπτωση, η ευθύνη θεμελιώνεται στο είδος της εταιρίας (ΟΕ) και στην εφαρμογή του άρθρ. 249 παρ. 1 και 258. Στη δεύτερη περίπτωση, η ευθύνη θεμελιώνεται σε σταθμίσεις καλής πίστης."",Τι είναι μία ομόρρυθμη εταιρία;,""Η Ομόρρυθμη Εταιρία (ΟΕ) είναι ένας εταιρικός τύπος του εμπορικού δικαίου, ο οποίος εμφανίστηκε στη μεσαιωνική Βόρεια Ιταλία. Νομικά ρυθμίζεται από τον Κώδικα Εμπορικού Δικαίου του 1807 και τον Γενικό Γερμανικό Εμπορικό Κώδικα του 1861. Στην Ελλάδα, ρυθμίστηκε από τον ΕμπΝ του 1935, ο οποίος ήταν μετάφραση του ναπολεόντειου κώδικα του 1807. Ο νόμος 4072/2012 ρυθμίζει πλέον την ομόρρυθμη εταιρία στα άρθρα 249-269. Η Ομόρρυθμη Εταιρία είναι μία νομική οντότητα που απαιτεί τουλάχιστον δύο εταίρους και οι εταίροι έχουν απεριόριστη ευθύνη για τα χρέη της εταιρίας."",Τι είναι το Γενικό Εμπορικό Μητρώο (ΓΕΜΗ);,""Το ΓΕΜΗ είναι ένα μητρώο επιχειρήσεων στην Ελλάδα, το οποίο περιέχει πληροφορίες σχετικά με τις επιχειρήσεις που δραστηριοποιούνται στη χώρα. Είναι υποχρεωτικό για όλες τις επιχειρήσεις να εγγραφούν στο ΓΕΜΗ και οι πληροφορίες που περιέχονται σε αυτό είναι διαθέσιμες στο κοινό."",""Ερώτηση 1: Τι είναι μία ομόρρυθμη εταιρία;"
Απάντηση 1: Η Ομόρρυθμη Εταιρία (ΟΕ) είναι ένας εταιρικός τύπος του εμπορικού δικαίου, ο οποίος εμφανίστηκε στη μεσαιωνική Βόρεια Ιταλία. Νομικά ρυθμίζεται από τον Κώδικα Εμπορικού Δικαίου του 1807 και τον Γενικό Γερμανικό Εμπορικό Κώδικα του 1861. Στην Ελλάδα, ρυθμίστηκε από τον ΕμπΝ του 1935, ο οποίος ήταν μετάφραση του ναπολεόντειου κώδικα του 1807. Ο νόμος 4072/2012 ρυθμίζει πλέον την ομόρρυθμη εταιρία στα άρθρα 249-269. Η Ομόρρυθμη Εταιρία είναι μία νομική οντότητα που απαιτεί τουλάχιστον δύο εταίρους και οι εταίροι έχουν απεριόριστη ευθύνη για τα χρέη της εταιρίας.

"Ερώτηση 2: Τι είναι το Γενικό Εμπορικό Μητρώο (ΓΕΜΗ);"
"Απάντηση 2: Το ΓΕΜΗ είναι ένα μητρώο επιχειρήσεων στην Ελλάδα, το οποίο περιέχει πληροφορίες σχετικά με τις επιχειρήσεις που δραστηριοποιούνται στη χώρα. Είναι υποχρεωτικό για όλες τις επιχειρήσεις να εγγραφούν στο ΓΕΜΗ και οι πληροφορίες που περιέχονται σε αυτό είναι διαθέσιμες στο κοινό."""
"§5,""Η ομόρρυθμη εταιρία είναι μια προσωπική εμπορική εταιρία με νομική προσωπικότητα που επιδιώκει εμπορικό σκοπό. Οι εταίροι έχουν απεριόριστη ευθύνη για τα χρέη της εταιρίας, κάτι που σημαίνει ότι οι προσωπικοί τους περιουσιακοί πόροι μπορούν να χρησιμοποιηθούν για την κάλυψη των χρεών της εταιρίας. Η εταιρική συμμετοχή αποκτάται συνήθως μέσω μιας συμφωνίας μεταξύ των εταίρων ή μέσω εγγραφής σε ένα μητρώο εταιριών. Μπορεί επίσης να αποκτηθεί μέσω κληρονομιάς ή δωρεάς. Η απώλεια της εταιρικής συμμετοχής μπορεί να συμβεί λόγω θανάτου, πτώχευσης ή αποχώρησης από την εταιρία."
Η εταιρική συμμετοχή είναι ένα απόλυτο δικαίωμα που προστατεύεται έναντι πάντων σύμφωνα με τις διατάξεις περί αδικοπραξιών. Η απόκτηση της εταιρικής συμμετοχής γίνεται με πρωτότυπο ή παράγωγο τρόπο, και δεν εκφράζει δικαίωμα συγκυριότητας στα περιουσιακά στοιχεία της εταιρίας καθώς λόγω της νομικής προσωπικότητας της ΟΕ η εταιρική περιουσία δεν είναι κοινή αλλά ανήκει στην ΟΕ ως διακριτό υποκείμενο δικαίου.
Η εταιρική συμμετοχή διέπεται από την αρχή του αδιασπάστου, η οποία απαγορεύει τη μεταβίβαση επιμέρους δικαιωμάτων σε τρίτους χωρίς τη μεταβίβαση της εταιρικής συμμετοχής εν συνόλω. Η αρχή του αδιασπάστου είναι απόρροια του γεγονότος ότι τα διοικητικά και περιουσιακά δικαιώματα κάθε εταίρου συνθέτουν ένα ενιαίο σύνολο, μέσω του οποίου εξυπηρετούνται τα συμφέροντα της εταιρίας και των εταίρων.
Η συμβατική ελευθερία είναι ένα βασικό χαρακτηριστικό στο δίκαιο των ομόρρυθμων εταιριών. Η εταιρική σύμβαση αποτελεί εμπόδιο στην εφαρμογή των διατάξεων ενδοτικού δικαίου και προϋπόθεση για την προσφυγή σε αυτές είναι η έλλειψη ειδικής πρόβλεψης στην εταιρική σύμβαση. Η συμβατική ελευθερία δεν είναι απαλλαγμένη περιορισμών, οι οποίοι μπορεί να έχουν ποικίλη προέλευση, όπως ο λεγόμενος «τύπος» της ΟΕ, διατάξεις αναγκαστικού δικαίου και άγραφοι κανόνες που αποσκοπούν στην προστασία των εταίρων. Τα δικαιώματα των εταίρων διακρίνονται σε περιουσιακά δικαιώματα και διοικητικά δικαιώματα.
Το δικαίωμα στα κέρδη στην ομόρρυθμη εταιρία δεν μπορεί να μεταβιβαστεί ξεχωριστά από την εταιρική συμμετοχή. Σύμφωνα με το άρθρο 764 ΑΚ, είναι άκυρος όρος στην εταιρική σύμβαση που προβλέπει τον αποκλεισμό εταίρου από τα κέρδη της εταιρίας. Η ακυρότητα είναι σχετική υπέρ του θιγόμενου εταίρου, ο οποίος και μόνο μπορεί να την επικαλεστεί.
Η παρακοινωνία είναι μία μορφή συμμετοχής στην επιχειρηματική δραστηριότητα κάποιου προσώπου χωρίς την εμφάνιση αυτού έναντι των τρίτων. Η εταιρία υφίσταται μόνο μεταξύ του εταίρου κάποιας εταιρίας (κύριος εταίρος) και του τρίτου προς την εταιρία, τον οποίο ο εταίρος προσλαμβάνει ως κοινωνό των δικαιωμάτων του στην υφιστάμενη εταιρία.
Το κείμενο αφορά τις υποχρεώσεις των ΟΕ και ΕΕ όσον αφορά την διανομή κερδών στους εταίρους τους. Οι εταίροι πρέπει να λαμβάνουν το κέρδος που προκύπτει από τα έσοδα της χρήσης μετά τους φόρους. Εάν δεν υπάρχουν κέρδη, τότε οι εταίροι δεν θα λάβουν καμία διανομή. Το κείμενο αναφέρει επίσης ότι εάν οι εταίροι αποφασίσουν να μην διανείμουν το κέρδος, αυτό παραμένει στην εταιρία ως περιουσία και δεν παρακολουθείται λογιστικά.
