Section,Summary,Question1,Answer1,Question2,Answer2,RawQnA
Η ανάκληση διαχειριστή εταιρίας περιορισμένης ευθύνης μπορεί να γίνει για σπουδαίο λόγο που αφορά το πρόσωπο του υπό ανάκληση διαχειριστή. Ο σπουδαίος λόγος θα πρέπει να αφορά στο πρόσωπο του υπό ανάκληση διαχειριστή και όχι στην ίδια την εταιρία ή στη διαχείριση της εταιρίας γενικότερα. Η ανάκληση δεν είναι απαραίτητο να βασίζεται σε υπαίτια συμπεριφορά, αλλά αρκεί η αντικειμενική βαρύτητα των πράξεων του διαχειριστή. Δεν απαιτείται οποιαδήποτε διατάραξη της άσκησης των διαχειριστικών καθηκόντων, αλλά θα πρέπει αυτή αντικειμενικά να έχει τέτοια βαρύτητα, που να καθιστά επισφαλές το μέλλον της εταιρίας.
Η ανάκληση καταστατικού διαχειριστή αναπτύσσει αποτελέσματα ανεξάρτητα από την ύπαρξη σπουδαίου λόγου, η έλλειψη του οποίου έχει σημασία μόνο για την γέννηση αποζημιωτικών αξιώσεων εκ μέρους του ανακληθέντος διαχειριστή. Παρά την ελκυστικότητα της τελευταίας αυτής άποψης δύσκολα μπορεί να γίνει δεκτή με βάση το ισχύον δίκαιο.
Η ανάκληση του καταστατικού διαχειριστή σε ομόρρυθμες εταιρείες δεν επηρεάζει την νόμιμη διαχείριση όλων των εταίρων. Η άποψη αυτή βασίζεται στο γεγονός ότι το σύστημα διαχείρισης και εκπροσώπησης της ομόρρυθμης εταιρείας που εισάγουν οι νέες διατάξεις του ν. 4072/2012 δεν παρουσιάζει ουσιώδεις αποκλίσεις από εκείνο του άρθρ. 22 ΕΝ, και η αναβίωση της νόμιμης διαχείρισης ισχύει ακόμη και υπό τις νέες διατάξεις.
Η περίληψη είναι η εξής:

1. Η νόμιμη διαχείριση αναβιώνει μόνο όταν για τη λειτουργία της καταστατικής διαχείρισης ήταν αναγκαία η σύμπραξη του ανακληθέντος καταστατικού διαχειριστή, υπό την επιφύλαξη τυχόν διαφορετικής πρόβλεψης στην εταιρική σύμβαση.
2. Εάν κάποιος νόμιμος διαχειριστής αδυνατεί σε μόνιμη βάση να ασκήσει τα καθήκοντά του, μπορεί να ζητήσει από τους συνεταίρους του με βάση την υποχρέωση πίστης να τον απαλλάξουν από τη διαχείριση μέσω υιοθέτησης κάποιας μορφής καταστατικής διαχείρισης.
3. Η παραίτηση διαχειριστή δεν περιορίζεται μόνο στην προς τα έσω διαχείριση, αλλά περιλαμβάνει και την εκπροσώπηση, καθώς οι δύο αυτές όψεις της διαχειριστικής εξουσίας παρέχονται κατά κανόνα μαζί.
4. Η παραίτηση γίνεται με μονομερή, απευθυντέα δήλωση βούλησης του διαχειριστή, η οποία από την περιέλευσή της στους συνεταίρους του επιφέρει την παύση της διαχειριστικής ιδιότητας.
5. Το δικαίωμα παραίτησης για σπουδαίο λόγο δεν μπορεί να αποκλεισθεί με την εταιρική σύμβαση.
Στο κείμενο που δόθηκε, γίνεται αναφορά σε έννοιες όπως η παραίτηση ενός εταίρου από την εταιρία, η έκτακτη και οι περιορισμοί της διαχειριστικής εξουσίας, καθώς και η εκπροσώπηση. Οι έννοιες αυτές είναι σημαντικές στο πλαίσιο των ομόρρυθμων εταιριών (ΟΕ) και συζητούνται με βάση το ελληνικό δίκαιο.
Το άρθρ. 254 παρ. 3 του ν. 4072/2012 ορίζει ότι η εξουσία διαχείρισης καταλαμβάνει όλες τις πράξεις συνήθους διοίκησης της εταιρίας και για τη διενέργεια πράξεων που βρίσκονται εκτός συνήθους διοίκησης απαιτείται η συναίνεση όλων των εταίρων. Η διάταξη αποτυπώνει έναν κανόνα, ο οποίος γινόταν δεκτός και στο προισχύσαν δίκαιο χωρίς σχετική ρύθμιση, με στόχο την προστασία των μη διαχειριστών εταίρων από πράξεις αυξημένου κινδύνου για την εταιρία. Ωστόσο, η προστασία δεν είναι απόλυτη, καθώς αφορά μόνο την προς τα έσω διαχείριση και όχι την εκπροσώπηση. Εάν δεν ληφθεί η απαιτούμενη συναίνεση των εταίρων ή εάν διενεργηθεί πράξη παρά την απόρριψη του αιτήματος για χορήγηση συναίνεσης, η πράξη παραμένει ισχυρή έναντι του τρίτου, αλλά ο διαχειριστής ευθύνεται έναντι της εταιρίας για τη ζημιά που αυτή υπέστη από την πράξη.
Το κείμενο συζητά τις έννοιες της συνήθους διαχείρισης και των ασυνήθων πράξεων σε εταιρικό πλαίσιο. Παρέχει επίσης πληροφορίες σχετικά με το δικαίωμα εναντίωσης ενός διαχειριστή εταίρου στην εκτέλεση μιας πράξης πριν από την εκτέλεσή της. Το κείμενο επισημαίνει ότι η συναίνεση των εταίρων απαιτείται για τη διενέργεια ασυνήθων διαχειριστικών πράξεων, και εάν οι εταίροι παράσχουν τη συναίνεσή τους, οι διαχειριστές οφείλουν να προβούν στην πράξη, απαλλάσσονται δε από κάθε ευθύνη έναντι της εταιρίας.
Το δικαίωμα εναντίωσης παρέχεται μόνο επί ατομικής διαχείρισης, είτε νόμιμη είτε καταστατική. Στις άλλες μορφές καταστατικής διαχείρισης δεν υφίσταται, καθώς λείπει ο λόγος ύπαρξής του. Δικαίωμα εναντίωσης διαθέτουν μόνο οι διαχειριστές εταίροι και όχι οι εταίροι που δεν είναι διαχειριστές. Εάν η διαχείριση έχει διαμορφωθεί κατά τομείς δράσης, το δικαίωμα εναντίωσης ασκείται από τους διαχειριστές στον τομέα δράσης των οποίων ανήκει η επιχειρούμενη ενέργεια. Εάν ισχύει μικτό σύστημα διαχείρισης με έναν διαχειριστή που ενεργεί ατομικά και περισσότερους που ενεργούν συλλογικά ή κατά πλειοψηφία, το δικαίωμα εναντίωσης ασκείται από τους λοιπούς διαχειριστές ενεργούντες συλλογικά ή κατά πλειοψη φία αντίστοιχα.
Το δικαίωμα εναντίωσης είναι ένα δικαίωμα που έχουν οι διαχειριστές μιας ομόρρυθμης εταιρίας να αντιταχθούν σε μια απόφαση διαχείρισης αν πιστεύουν ότι η απόφαση δεν είναι προς το καλύτερο συμφέρον της εταιρίας ή των εταίρων. Αυτό το δικαίωμα μπορεί να ασκηθεί από έναν διαχειριστή, αλλά συνήθως ασκείται συλλογικά από όλους τους διαχειριστές. Εάν ένας διαχειριστής ασκήσει το δικαίωμα εναντίωσης και παρόλα αυτά ο άλλος διαχειριστής προχωρήσει με την πράξη διαχείρισης, τότε ο πρώτος διαχειριστής έχει ευθύνη έναντι της εταιρίας για οποιαδήποτε ζημιά προκληθεί ως αποτέλεσμα αυτής της πράξης.
Η διάταξη του άρθρ. 257 παρ. 3 εδ. β΄ είναι αναγκαστικού δικαίου και αποσκοπεί στην προστασία των συναλλαγών. Ο κανόνας του απεριόριστου της εκπροσωπευτικής εξουσίας από τον εταιρικό σκοπό εφαρμόζεται και στις προσωπικές εταιρίες, εκτός αν ο τρίτος είναι κακόπιστος. Η νομική λειτουργία της εκπροσώπησης εκτείνεται σε όλες τις δικαστικές και εξώδικες πράξεις που εμπίπτουν στην επιδίωξη του σκοπού της εταιρίας.
Η ΟΕ είναι μία νομική οντότητα που έχει απεριόριστη ευθύνη για τα χρέη της. Η εκπροσώπησή της γίνεται από τους διαχειριστές της και οι πράξεις τους δεσμεύουν την εταιρία, εκτός αν η πράξη υπερβαίνει τον εταιρικό σκοπό ή το αντικείμενο της εταιρίας. Το βάρος απόδειξης της κακοπιστίας του τρίτου φέρει η εταιρία, ενώ ο τρίτος δεν μπορεί να επικαλεστεί την υπέρβαση. Εάν τελικά η πράξη δεν δεσμεύει την εταιρία, θα ισχύσουν οι γενικές διατάξεις του ΑΚ για τον ψευδοαντιπρόσωπο. Η υπέρβαση του εταιρικού σκοπού εκφεύγει της εξουσίας των διαχειριστών και απαιτεί τη συναίνεση των εταίρων.
Η εκπροσωπουτική εξουσία των διαχειριστών δεν περιορίζεται από τον εταιρικό σκοπό ή από περιορισμούς που τίθενται στην εταιρική σύμβαση ή σε αποφάσεις των εταίρων, εκτός αν προβλέπεται διαφορετικά στον νόμο. Οι περιορισμοί αυτοί αφορούν μόνο την εσωτερική διαχείριση και δεν επηρεάζουν την εκπροσωπούντικη εξουσία των διαχειριστών έναντι τρίτων. Η εκπροσώπηση της εταιρίας είναι απεριόριστη και οι τρίτοι δεν μπορούν να επικαλεστούν τους εσωτερικούς αυτούς περιορισμούς για να αμφισβητήσουν τη νομιμότητα πράξεων που διενεργούνται από τους διαχειριστές στο όνομα της εταιρίας.
Η διαχείριση και εκπροσώπηση της ομόρρυθμης εταιρίας γίνεται από τους διαχειριστές εταίρους σύμφωνα με το νόμο και το καταστατικό. Το άρθρ. 751 ΑΚ επιτρέπει σε έναν διαχειριστή εταίρο να λαμβάνει επείγοντα μέτρα χωρίς τη συναίνεση των άλλων διαχειριστών ή παρά την εναντίωσή τους, αν πρόκειται για σοβαρή ζημία της εταιρίας.
Το άρθρο 751 ΑΚ εφαρμόζεται και στους εκκαθαριστές. Στο νόμο τίθενται δύο προϋποθέσεις, οι οποίες θα πρέπει να συντρέχουν σωρευτικά προκειμένου να ενεργοποιηθεί το δικαίωμα ατομικής ενέργειας του διαχειριστή: Πρώτον, πρόκειται για επείγον διαχειριστικό μέτρο και δεύτερον, απειλείται από την παράλειψη του σοβαρή ζημιά της εταιρίας (θετική ή αποθετική). Η διάταξη του άρθρου 751 ΑΚ είναι εξαιρετική και θα πρέπει να εφαρμόζεται με φειδώ, διότι εισάγει απόκλιση από τον τρόπο διαχείρισης και εκπροσώπησης της εταιρίας.
"Το κείμενο συζητά τη νομική έννοια της εναντίωσης και την επίδρασή της στην εκπροσωπευτική εξουσία των διαχειριστών μίας προσωπικής εταιρίας. Το άρθρο 751 ΑΚ επιτρέπει σε έναν διαχειριστή να αντιταχθεί σε μία συναλλαγή που πραγματοποιήθηκε από άλλον διαχειριστή, αλλά αυτή η διάταξη δεν εφαρμόζεται άμεσα στο ζήτημα της εσωτερικής ευθύνης του ενεργήσαντος διαχειριστή. Η ευθύνη θα κριθεί με βάση την υποχρέωση επιμέλειας διαχείρισης."",Ποια είναι τα καθήκοντα των διαχειριστών σε μια ομόρρυθμη εταιρία;,""Τα καθήκοντα των διαχειριστών σε μια ομόρρυθμη εταιρία περιλαμβάνουν τη διαχείριση και εκπροσώπηση της εταιρίας, την εσωτερική οργάνωση της παραγωγής ή του δικτύου διανομής, καθώς και την τήρηση λογιστικών αρχείων. Είναι υπεύθυνοι για τις πράξεις τους απέναντι στην εταιρία και ευθύνονται εις ολόκληρο μαζί με αυτήν."",Ποια είναι η σχέση μεταξύ των διαχειριστών και της εταιρίας;,""Η σχέση μεταξύ των διαχειριστών και της εταιρίας είναι οργανική σχέση εταιρικού δικαίου. Οι διαχειριστές αποτελούν τα διαχειριστικά όργανα της εταιρίας, ενώ οι πράξεις τους θεωρούνται ως πράξεις του νομικού προσώπου της εταιρίας."",""Ερώτηση 1: Ποια είναι τα καθήκοντα των διαχειριστών σε μια ομόρρυθμη εταιρία;"
Απάντηση 1: Τα καθήκοντα των διαχειριστών σε μια ομόρρυθμη εταιρία περιλαμβάνουν τη διαχείριση και εκπροσώπηση της εταιρίας, την εσωτερική οργάνωση της παραγωγής ή του δικτύου διανομής, καθώς και την τήρηση λογιστικών αρχείων. Είναι υπεύθυνοι για τις πράξεις τους απέναντι στην εταιρία και ευθύνονται εις ολόκληρο μαζί με αυτήν.
"Ερώτηση 2: Ποια είναι η σχέση μεταξύ των διαχειριστών και της εταιρίας;"
"Απάντηση 2: Η σχέση μεταξύ των διαχειριστών και της εταιρίας είναι οργανική σχέση εταιρικού δικαίου. Οι διαχειριστές αποτελούν τα διαχειριστικά όργανα της εταιρίας, ενώ οι πράξεις τους θεωρούνται ως πράξεις του νομικού προσώπου της εταιρίας."""
"§7,""Η συνέλευση των εταίρων είναι το εταιρικό όργανο που λαμβάνει αποφάσεις για τη λειτουργία της εταιρίας και τη ρύθμιση των σχέσεων μεταξύ των εταίρων. Το νομοθετικό πλαίσιο για την ομόρρυθμη εταιρία δεν περιέχει λεπτομερείς διατάξεις σχετικά με τον τρόπο σύγκλησης, συγκρότησης και λήψης αποφάσεων από τους εταίρους. Η θεωρία και η νομολογία έχουν αναλάβει να αναπτύξουν κανόνες λειτουργίας για τη συνέλευση των εταίρων, οι οποίοι θα διασφαλίζουν διαφάνεια στη λειτουργία του οργάνου και στην άσκηση του δικαιώματος ψήφου των εταίρων, χωρίς όμως να επιβαρύνουν την εταιρία με περιττές διαδικαστικές τυπικότητες."
Η συνέλευση των εταίρων είναι το ανώτατο όργανο στην εταιρική οργάνωση, καθώς σε αυτό εκφράζεται η βούληση των εταίρων. Η απόφαση της συνέλευσης δεν συνιστά μία ενοχική συμφωνία, αλλά μία δικαιοπραξία οργανωτικού χαρακτήρα, η οποία αυτονομείται από τις δηλώσεις βούλησης των εταίρων και καταλογίζεται στο νομικό πρόσωπο της εταιρίας με την έννοια ότι καθίσταται νομική πράξη του νομικού προσώπου, δεσμεύοντας τους μειοψηφούντες εταίρους εάν η απόφαση λαμβάνεται πλειοψηφικά.
Η συνέλευση των εταίρων έχει γενική αρμοδιότητα να αποφασίζει επί παντός θέματος. Η συνέλευση είναι αρμόδια για την τροποποίηση της εταιρικής σύμβασης και τις ad hoc παρεκκλίσεις από αυτήν, τη λύση και αναβίωση της εταιρίας, εταιρικούς μετασχηματισμούς (συγχώνευση, διάσπαση, μετατροπή), εκλογή διαχειριστών και ανάκληση καταστατικά διορισθέντων διαχειριστών, έγκριση ετήσιων χρηματοοικονομικών καταστάσεων, διάθεση κερδών, εκλογή εκκαθαριστών, εποπτεία επί των διαχειριστών και θέση ορίων στη διαχειριστική και εκπροσωπευτική εξουσία τους, λήψη στρατηγικής φύσης αποφάσεων σχετικά με τη λειτουργία της εταιρίας, έγκριση για τη διενέργεια σημαντικών περιουσιακών μεταβολών από τους διαχειριστές, υποβολή αίτησης πτώχευσης επί επαπειλούμενης παύσης πληρωμών.
Η τροποποίηση της εταιρικής σύμβασης γίνεται μέσω απόφασης της συνέλευσης των εταίρων και μπορεί να λάβει χώρα κατά την εκκαθάριση, εφόσον αυτό προβλέπεται στην εταιρική σύμβαση. Η απόφαση τροποποίησης λαμβάνεται από το αρμόδιο εταιρικό όργανο και η τροποποίηση μπορεί να γίνει με πλειοψηφική απόφαση της συνέλευσης των εταίρων, εάν προβλέπεται στην εταιρική σύμβαση. Το περιεχόμενο της εταιρικής σύμβασης τροποποιείται σύμφωνα με το κοινό δίκαιο, δηλαδή με νεότερη συμφωνία μεταξύ των συμβαλλόμενων μερών.
Η συνέλευση συγκαλείται από τους διαχειριστές, όπως και από κάθε εταίρο. Η σύγκληση μπορεί να γίνει με κάθε τρόπο, εγγράφως ή προφορι κά, χωρίς να απαιτείται δημοσιότητα στο Γ.Ε.ΜΗ. Θα πρέπει σε κάθε περίπτω ση να διασφαλίζεται η έγκαιρη ενημέρωση των εταίρων για την πραγματοποίηση της συνέλευσης σε συγκεκριμένο χρόνο και τόπο και για τα θέματα της ημερήσιας διάταξης, ούτως ώστε να αποφεύγονται αιφνιδιασμοί και να ασκείται αποτε λεσματικά το δικαίωμα ψήφου προς εξυπηρέτηση τόσο του εταιρικού συμφέροντος, όσο και του ατομικού συμφέροντος των εταίρων.
Στην ομόρρυθμη και ετερόρρυθμη εταιρία, η συνέλευση των εταίρων μπορεί να λάβει αποφάσεις με πλειοψηφία. Η πλειοψηφική λήψη αποφάσεων διευκολύνει τη λειτουργία της εταιρίας αλλά εγείρει ζητήματα προστασίας της μειοψηφίας. Το καταστατικό μπορεί να προβλέπει ότι οι αποφάσεις λαμβάνονται κατά πλειοψηφία ή κατά πλειοψηφία μερίδων.
Η συνέλευση των εταίρων είναι το ανώτατο όργανο λήψης αποφάσεων στην ομόρρυθμη εταιρία και έχει την εξουσία να αποφασίζει για όλα τα θέματα που αφορούν την εταιρία, εκτός αν ορίζεται διαφορετικά στο νόμο ή στο καταστατικό. Κάθε εταίρος έχει μία ψήφο στη συνέλευση, αλλά μπορεί να προβλέπεται διαφορετική ρύθμιση στην εταιρική σύμβαση, όπως ο αριθμός ψήφων με βάση το ποσοστό συμμετοχής ή το ύψος της εισφοράς κάθε εταίρου. Η άσκηση του δικαιώματος ψήφου είναι μία μονομερή, απευθυντέα (προς τους λοιπούς εταίρους ή προς τον πρόεδρο της συνέλευσης), ανεπίδεκτη αίρεσης και προθεσμίας και μη ανακλητή δήλωση βούλησης δικαιοπρακτικού χαρακτήρα που μπορεί να γίνει προφορικά ή εγγράφως, ανάλογα με τις προβλέψεις της εταιρικής σύμβασης ή τη σχετική απόφαση των εταίρων ή τη διαμορφωμένη εταιρική πρακτική.
